{
  "contractVersion": "1.0",
  "messageId": "19000000-0000-4000-8000-000000000021",
  "correlationId": "19000000-0000-4000-8000-000000000022",
  "idempotencyKey": "reconciliation:19000000-0000-4000-8000-000000000023:revision:1",
  "messageType": "RECONCILIATION_STATUS",
  "operationCode": "SPOILAGE_WRITEOFF",
  "sourceSystem": "TASHKALINSKAYA_CONTROL",
  "targetSystem": "ONE_C",
  "occurredAt": "2026-08-01T11:15:00.000Z",
  "payload": {
    "internalDocumentId": "19000000-0000-4000-8000-000000000023",
    "externalDocumentNumber": "DEMO-2026-0001",
    "revision": 1,
    "result": "MATCHED"
  }
}
